{
  "schema_version": 1,
  "contract_version": "1.1.0",
  "release_status": "supported",
  "compatibility": {
    "reset_from": "1.0",
    "stable_from": "1.1.0",
    "breaking_changes_after_reset": "next-major"
  },
  "languages": {
    "rust": {
      "runtime_floor": "1.94",
      "package": "crates.io/forgelib"
    },
    "javascript": {
      "runtime_floor": "Node.js 20 or Bun 1.2",
      "package": "npm/forgelib"
    },
    "python": {
      "runtime_floor": "3.9",
      "package": "PyPI/forgelib"
    },
    "go": {
      "runtime_floor": "1.26",
      "package": "github.com/isala404/forge/bindings/go"
    }
  },
  "units": {
    "durations": "seconds unless a field ends in _ms",
    "timestamps": "Unix epoch milliseconds",
    "sizes": "bytes",
    "counts": "non-negative integers"
  },
  "defaults": {
    "queue_max_attempts": 5,
    "queue_visibility_seconds": 30,
    "queue_wait_seconds": 0,
    "scan_limit": 100,
    "blob_list_limit": 100,
    "queue_status_list_limit": 50,
    "queue_priority": "normal",
    "shutdown_grace_seconds": 30
  },
  "limits": {
    "key_bytes": 512,
    "kv_value_bytes": 1048576,
    "queue_payload_bytes": 262144,
    "queue_envelope_metadata_bytes": 8192,
    "queue_concurrency_key_bytes": 256,
    "ratelimit_units": 2147483647,
    "ratelimit_reservation_seconds": 3600,
    "blob_buffered_bytes": 52428800,
    "blob_key_bytes": 1024,
    "pubsub_payload_bytes": 7168,
    "invalidation_event_bytes": 4096,
    "invalidation_targets": 64,
    "scope_component_bytes": 255,
    "scoped_name_key_bytes": 383,
    "scoped_name_blob_bytes": 895,
    "config_value_bytes": 65536,
    "password_bytes": 4096,
    "token_purpose_bytes": 255
  },
  "errors": [
    {
      "code": "CONFIG",
      "retryable": false,
      "safe_message": "invalid Forge configuration"
    },
    {
      "code": "NOT_CONFIGURED",
      "retryable": false,
      "safe_message": "the requested capability is not configured"
    },
    {
      "code": "UNAVAILABLE",
      "retryable": true,
      "safe_message": "a backend is temporarily unavailable"
    },
    {
      "code": "NOT_FOUND",
      "retryable": false,
      "safe_message": "the requested value was not found"
    },
    {
      "code": "PRECONDITION",
      "retryable": false,
      "safe_message": "an operation precondition failed"
    },
    {
      "code": "LIMIT",
      "retryable": false,
      "safe_message": "a configured or contract limit was exceeded"
    },
    {
      "code": "INVALID",
      "retryable": false,
      "safe_message": "an argument is invalid"
    },
    {
      "code": "BACKEND",
      "retryable": false,
      "safe_message": "a backend operation failed"
    }
  ],
  "backend_capabilities": [
    "durable",
    "shared_across_processes",
    "presign_proxy",
    "presign_native",
    "streaming",
    "multipart",
    "notifications"
  ],
  "lifecycle": {
    "states": [
      "running",
      "closing",
      "closed"
    ],
    "reject_work_after": "closing",
    "signal_handlers": "application-owned",
    "shutdown": "idempotent and bounded by caller context or deadline"
  },
  "dtos": [
    {
      "name": "Job",
      "node_name": "JsJob",
      "python_name": "Job",
      "clone": false,
      "doc": "A leased queue job.",
      "fields": [
        {
      "name": "id",
      "type": "string",
          "doc": ""
        },
        {
          "name": "receipt",
          "type": "string",
          "doc": ""
        },
        {
      "name": "payload",
      "type": "bytes",
          "doc": ""
        },
        {
          "name": "attempt",
          "type": "uint32",
          "doc": ""
        },
        {
          "name": "max_attempts",
          "type": "uint32",
          "doc": ""
        },
        {
          "name": "leased_until_ms",
          "type": "float64",
          "doc": ""
        },
        {
          "name": "queue",
          "type": "string",
          "doc": ""
        },
        {
          "name": "traceparent",
          "type": "string?",
          "doc": "Validated W3C traceparent stored outside the payload."
        },
        {
          "name": "tracestate",
          "type": "string?",
          "doc": "Validated W3C tracestate."
        },
        {
          "name": "baggage",
          "type": "string?",
          "doc": "Allow-listed W3C baggage only."
        }
      ]
    },
    {
      "name": "Decision",
      "node_name": "JsDecision",
      "python_name": "Decision",
      "clone": false,
      "doc": "A rate-limit decision.",
      "fields": [
        {
          "name": "allowed",
          "type": "boolean",
          "doc": ""
        },
        {
          "name": "limit",
          "type": "uint32",
          "doc": ""
        },
        {
          "name": "remaining",
          "type": "uint32",
          "doc": ""
        },
        {
          "name": "reset_after_seconds",
          "type": "float64",
          "doc": ""
        },
        {
          "name": "retry_after_seconds",
          "type": "float64?",
          "doc": ""
        }
      ]
    },
    {
      "name": "ApiKey",
      "node_name": "JsApiKey",
      "python_name": "ApiKey",
      "clone": false,
      "doc": "A freshly minted API key whose secret is shown once.",
      "fields": [
        {
          "name": "id",
          "type": "string",
          "doc": ""
        },
        {
          "name": "secret",
          "type": "string",
          "doc": ""
        },
        {
          "name": "label",
          "type": "string",
          "doc": ""
        },
        {
          "name": "created_at_ms",
          "type": "float64",
          "doc": ""
        },
        {
          "name": "expires_at_ms",
          "type": "float64?",
          "doc": ""
        },
        {
          "name": "scopes",
          "type": "string[]",
          "doc": "Application-owned authorization labels; Forge stores but does not interpret them."
        },
        {
          "name": "metadata",
          "type": "string_map",
          "doc": "Bounded application metadata."
        }
      ]
    },
    {
      "name": "QueueDepth",
      "node_name": "JsQueueDepth",
      "python_name": "QueueDepth",
      "clone": false,
      "doc": "Approximate queue depth.",
      "fields": [
        {
          "name": "visible",
          "type": "count",
          "doc": ""
        },
        {
          "name": "in_flight",
          "type": "count",
          "doc": ""
        },
        {
          "name": "delayed",
          "type": "count",
          "doc": ""
        },
        {
          "name": "oldest_visible_age_ms",
          "type": "float64?",
          "doc": "Age of the oldest visible job, or null when none is visible."
        }
      ]
    },
    {
      "name": "DeadLetterInfo",
      "node_name": "JsDeadLetterInfo",
      "python_name": "DeadLetterInfo",
      "clone": true,
      "doc": "Payload-free operator metadata for one dead letter.",
      "fields": [
        { "name": "job_id", "type": "string", "doc": "" },
        { "name": "queue", "type": "string", "doc": "" },
        { "name": "attempt_count", "type": "uint32", "doc": "" },
        { "name": "enqueued_at_ms", "type": "float64", "doc": "" },
        { "name": "dead_lettered_at_ms", "type": "float64", "doc": "" },
        { "name": "failure_summary", "type": "string?", "doc": "Bounded and redacted." }
      ]
    },
    {
      "name": "BatchEnqueueResult",
      "node_name": "JsBatchEnqueueResult",
      "python_name": "BatchEnqueueResult",
      "clone": false,
      "doc": "Ordered result for one item in a non-atomic batch enqueue.",
      "fields": [
        { "name": "job_id", "type": "string?", "doc": "Effective deterministic job ID on success." },
        { "name": "error_code", "type": "string?", "doc": "Stable Forge error code on failure." },
        { "name": "retryable", "type": "boolean", "doc": "Whether retrying the failed item may succeed unchanged." },
        { "name": "message", "type": "string?", "doc": "Safe bounded failure message." }
      ]
    },
    {
      "name": "QueueStats",
      "node_name": "JsQueueStats",
      "python_name": "QueueStats",
      "clone": false,
      "doc": "Counter-based queue activity and indexed age estimate.",
      "fields": [
        { "name": "enqueued_total", "type": "count", "doc": "Monotonic enqueue counter." },
        { "name": "settled_total", "type": "count", "doc": "Monotonic terminal settlement counter." },
        { "name": "dead_total", "type": "count", "doc": "Monotonic dead-letter transition counter." },
        { "name": "cancelled_total", "type": "count", "doc": "Monotonic cancellation counter." },
        { "name": "enqueue_rate_per_minute", "type": "float64", "doc": "Lifetime-average enqueue estimate." },
        { "name": "settle_rate_per_minute", "type": "float64", "doc": "Lifetime-average settlement estimate." },
        { "name": "oldest_visible_age_ms", "type": "float64?", "doc": "Indexed age of the oldest visible job." },
        { "name": "paused", "type": "boolean", "doc": "Whether new leases are paused." }
      ]
    },
    {
      "name": "DeadLetterPage",
      "node_name": "JsDeadLetterPage",
      "python_name": "DeadLetterPage",
      "clone": false,
      "doc": "A bounded page of dead letters.",
      "fields": [
        { "name": "items", "type": "DeadLetterInfo[]", "doc": "" },
        { "name": "cursor", "type": "string?", "doc": "" }
      ]
    },
    {
      "name": "RedriveBatchResult",
      "node_name": "JsRedriveBatchResult",
      "python_name": "RedriveBatchResult",
      "clone": false,
      "doc": "Result of one bounded batch redrive.",
      "fields": [
        { "name": "redriven", "type": "uint32", "doc": "" },
        { "name": "cursor", "type": "string?", "doc": "" }
      ]
    },
    {
      "name": "OutboxRelayReport",
      "node_name": "JsOutboxRelayReport",
      "python_name": "OutboxRelayReport",